RatingDate,Rating,ISBN,UserID,CommentDate,Comment
2024-02-18,4,978-0-14-103614-4,1001,2024-02-18,"Enjoyed the depth of characters."
2024-02-17,5,978-0-345-39180-8,1002,2024-02-17,"A classic that remains relevant."
2024-02-16,5,978-0-006-112008-4,1003,2024-02-16,"This book is a masterpiece."
2024-02-15,4,978-0-14-118104-5,1004,2024-02-15,"Beautifully written, magical storytelling."
2024-02-14,5,978-0-553-21311-6,1005,2024-02-14,"A journey through imagination."
2024-02-13,4,978-0-452-28423-4,1006,2024-02-13,"Witty but didn't resonate with me."
2024-02-12,5,978-0-679-72126-2,1007,2024-02-12,"A chilling glimpse into a possible future."
2024-02-11,3,978-0-7432-7356-0,1008,2024-02-11,"Entertaining but not groundbreaking."
2024-02-10,5,978-0-575-04606-1,1009,2024-02-10,"A timeless tale of magic and friendship."
2024-02-09,4,978-0-312-35983-0,1010,2024-02-09,"Engaging story with unexpected twists."
2024-02-08,5,978-0-006-112008-5,1011,2024-02-08,"A literary masterpiece."
2024-02-07,4,978-0-451-52493-5,1012,2024-02-07,"A cautionary tale for our times."
2024-02-06,3,978-0-7432-4722-1,1013,2024-02-06,"A fast-paced thriller."
2024-02-05,4,978-0-7434-9271-5,1014,2024-02-05,"Heart-wrenching and thought-provoking."
2024-02-04,5,978-0-330-25864-8,1015,2024-02-04,"A powerful allegory."
2024-02-03,4,978-0-8129-8131-3,1016,2024-02-03,"Intricate world-building and complex characters."
2024-02-02,5,978-0-006-112008-6,1017,2024-02-02,"A timeless love story."
2024-02-01,4,978-0-014-312639-3,1018,2024-02-01,"A bleak yet gripping narrative."
2024-01-31,4,978-0-679-72243-6,1019,2024-01-31,"A unique take on time travel."
2024-01-30,4,978-0-553-38516-1,1020,2024-01-30,"Classic horror with a psychological twist."
2024-01-29,5,978-0-006-057377-5,1021,2024-01-29,"A must-read for understanding political philosophy."
2024-01-28,3,978-0-399-13131-4,1022,2024-01-28,"Slow start but gripping once it picks up."
2024-01-27,4,978-0-375-50190-9,1023,2024-01-27,"A thrilling dystopian adventure."
2024-01-26,5,978-0-452-28425-8,1024,2024-01-26,"A captivating journey of survival."
2024-01-25,3,978-0-553-21461-8,1025,2024-01-25,"Another epic installment in the series."
2024-01-24,4,978-0-307-47640-1,1026,2024-01-24,"An eye-opening exploration of race and identity."
2024-01-23,5,978-0-451-52494-2,1027,2024-01-23,"Science fiction at its best."
2024-01-22,3,978-0-345-47699-1,1028,2024-01-22,"Predictable plot twists."
2024-01-21,4,978-0-440-53603-6,1029,2024-01-21,"A sprawling epic of survival and humanity."
2024-01-20,5,978-0-553-21105-4,1030,2024-01-20,"A timeless fantasy adventure."